{
  "schemaVersion": "1.0.0",
  "providerId": "assayer.browser-snapshot",
  "providerVersion": "0.1.0",
  "platformApiVersion": "1.0.0",
  "registration": "assayer_browser_provider:browser_registration",
  "fixtureRuntime": "assayer_browser_provider:browser_fixture_runtime",
  "providerDescriptor": "src/assayer_browser_provider/descriptor.json",
  "runtimeSource": "src",
  "fixtures": [
    "provider/fixtures/success.json",
    "provider/fixtures/stale-state.json"
  ],
  "packageMetadata": "pyproject.toml",
  "conformance": {
    "contractVersion": "1.0.0"
  }
}
